video_id,title,publishedAt,channelId,channelTitle,categoryId,trending_date,tags,view_count,likes,dislikes,comment_count,thumbnail_link,comments_disabled,ratings_disabled,description
"gacvkulf1U8","СЪЕШЬ 5 кг ОЛИВЬЕ за 20 000 РУБЛЕЙ ЧЕЛЛЕНДЖ","2019-12-21T07:43:48.000Z","UCjm6XUTNSz8Q68WqJIMJ0eQ","ABRACADABRA TV","22","19.22.12","Еда|СЪЕШЬ 5 кг ОЛИВЬЕ|5 кг оливье|Оливье|СЪЕШЬ 5 кг ОЛИВЬЕ за 20000 РУБЛЕЙ|Оливье челлендж|Заказ еды из ресторана|Доставка еда|Съешь челлендж|Съел 5 кг оливье|Заказали еду в ресторане|Заказ еды онлайн|Чайхана москва|Еда челлендж|Съел много еды на время|Съел 5 кг оливье за раз|Абракадабра|Abracadabra tv|Еда заказ ресторан|Оливье за 20000 рублей|как есть правильно|Еда доставка","373829","35055","2218","6036","https://i.ytimg.com/vi/gacvkulf1U8/default.jpg","False","False","Зарабатывай со СТАРТАПФОНД https://startupmoney.company/?partner=abracadabraИнстаграм Серёги - https://www.instagram.com/kishkobludtop/Канал AbraGames - https://bit.ly/2XDPQvPКанал ABRACADABRA LIFE - https://goo.gl/if3DuYИнстаграм Abracadabra - https://goo.gl/jN3t9gГруппа ВК - https://vk.com/abracadabra_tvТелеграм - https://bit.ly/2pNFXbuВ данном ролике мы приехали в ресторан Чайхона, чтобы Серега попробовал себя в очередном фуд челлендже, вы много писали про то, чтобы Сергей попробовал съесть за раз 5 кг оливье и ваше желание было услышано, к тому же я предложил Сереге достойную мотивацию в виде 20000 тысяч рублей ,если он съедает 5 кг за раз, то забирает деньги. Пишите в комментариях чтобы хотели, чтобы Кишкоблуд Серега исполнил и кстати сколько оливье сможете съесть или съедали за раз вы?"
"mfhRQKzL_pE","Кому слабо? / Челлендж!","2019-12-21T08:00:09.000Z","UCq1JpGFxcZTbbOAz010U-og","Трум Трум","26","19.22.12","Челлендж|Кому слабо|слабо|веселые челленджи|челлендж на слабо|тебе слабо|сделай это|попробуй повтори|классный челлендж|крутой челлендж|повтори за мной|сможешь повторить|А вам слабо|челлендж кому слабо|челлендж кому слабо задания|как сделать челлендж кому слабо|челлендж кому слабо идеи|жесткий челлендж|челленжд кому слабо еда|челледж на слабо|Трум Трум","681421","18229","1322","1130","https://i.ytimg.com/vi/mfhRQKzL_pE/default.jpg","False","False","Подписывайся на канал Вау! Моушн: https://www.youtube.com/channel/UCfJ0lFBtEKmIK47L7Hew0RA?sub_confirmation=115 взрывов в замедленной съемке / Взрывная блондинка: https://youtu.be/w_Ld_YxDQAkОгромные и миниатюрные новогодние сладости! Пряничный человечек и леденец!: https://youtu.be/7ovef1Cg4Wk?list=PLw_MSrc8v85eSeueqNkzp9Bo8VA3h1NXnВам с друзьями скучно? Тогда следите за нашими новыми челленджами! Мы собираемся проверить, насколько вы смелые и сможете ли повторить наш вызов?Больше интересного на Трум Трум: Самые популярные видео:11 смешных пранков над друзьями: https://youtu.be/lgc_oB9PHTEИгрушки антистресс из лизунов – 5 идей: https://youtu.be/41qTHIIszJw9 смешных пранков над друзьями: https://youtu.be/vm0nqPVsiacКанцелярия в виде сладостей – 10 идей: https://youtu.be/BToiJYPPjAgСъедобная канцелярия / 11 смешных пранков над друзьями: https://youtu.be/jycXSj3Y7TEСамые популярные плейлисты:Смешные пранки: https://www.youtube.com/playlist?list=PLw_MSrc8v85dDBhA0b_b7QBBbHvI_MF-pНазад в школу: https://www.youtube.com/playlist?list=PLw_MSrc8v85dbXD675VK7E8V30ZpbiLBeЛайфхаки: https://www.youtube.com/playlist?list=PLw_MSrc8v85fwxaXVeX10CQzrD3fSWvJRДомашняя косметика: https://www.youtube.com/playlist?list=PLw_MSrc8v85eT8V5Y54vJMGFfPijOjexyКлёвые лизуны и сквиши своими руками: https://www.youtube.com/playlist?list=PLw_MSrc8v85djEuws3Jf50fg_3bszqeWi★ Давай дружить: Подписывайся на канал: https://www.youtube.com/channel/UCq1JpGFxcZTbbOAz010U-og?sub_confirmation=1Facebook | https://www.facebook.com/troomtroom.rus Вконтакте | http://vk.com/troomtroom Pinterest | https://www.pinterest.com/troomtroomru Instagram | https://www.instagram.com/troomtroomru/Troom Troom English: Подписывайся: https://www.youtube.com/channel/UCWwqHwqLSrdWMgp5DZG5Dzg?sub_confirmation=1Troom Troom Español: Подписывайся:  https://www.youtube.com/channel/UCu6oyJJ6PlkeNNv6n26ZNyA?sub_confirmation=1Troom Troom Française:Подписывайся: https://www.youtube.com/channel/UCyNeKmBHI10u4bwYEKimlZA?sub_confirmation=1Troom Troom Deutsch:Подписывайся: https://www.youtube.com/channel/UCzgmxZIlgfH1fgch7OpigIA?sub_confirmation=1Troom Troom Japanese:Подписывайся:   https://www.youtube.com/channel/UCPCwT9JMWPjg6xAWrQxhQaw?sub_confirmation=1Troom Troom Chinese:Подписывайся: https://www.youtube.com/channel/UCV3NWBs2K7pOEGmI4w_2dhg?sub_confirmation=1Troom Troom Português:Подписывайся: https://www.youtube.com/channel/UCgCQlMYN2XypwYC2wcR32bA?sub_confirmation=1О канале Трум Трум: Простые мастер-классы - как сделать своими руками классные поделки! У нас на канале вы найдете мастер-классы по скрапбукингу, плетению из газетных трубочек, поделки из папье-маше и многое другое. Сделайте это легко! Make it easy!По вопросам сотрудничества пишите на:  troomtroom.ru@gmail.comВопрос дня: понравились наши идеи для челленджа? Пиши в комментариях!Не забудь подписаться, нажать на колокольчик рядом с подпиской, ставить лайки и делиться видео с друзьями!"
"mMc62Q6EydM","21.12.2019 Монако - Лилль - 5:1. Обзор матча","2019-12-21T22:03:57.000Z","UCtetJiD_llxdGL4Uh5-Oe2w","Матч ТВ","17","19.22.12","Матч ТВ|Спорт|Все на Матч|Матч|Монако|Лилль|Чемпионат|Франции|Гол|Обзор|Болельщик|Футбол|Хайлайт|Момент|Головин|Бен-Йеддер","159604","7360","113","367","https://i.ytimg.com/vi/mMc62Q6EydM/default.jpg","False","False","Статистика матча: https://news.sportbox.ru/Vidy_sporta/Futbol/Evropejskie_chempionaty/Franciya/stats/turnir_15974/game_1380705744Подписаться на канал: https://www.youtube.com/channel/UCtetJiD_llxdGL4Uh5-Oe2w?sub_confirmation=1Чтобы получать уведомления о новых видео, жмите на колокольчик!Больше видео с лучшими моментами матчей на нашем официальном сайте: https://matchtv.ru/Матч ТВ в соцсетях:ВКОНТАКТЕ: https://vk.com/matchtv  FACEBOOK: https://www.facebook.com/MatchTVChannelTWITTER: https://twitter.com/MatchTVINSTAGRAM: https://www.instagram.com/matchtv_channel/ОДНОКЛАССНИКИ: https://ok.ru/matchtvchannelСкачивайте официальное приложение МАТЧ!:IOS: https://itunes.apple.com/app/apple-store/id1051293689?mt=8ANDROID: https://play.google.com/store/apps/details?id=com.tviztv.tviz2x45&referrer=utm_source%3DMatchTVinVKФото анонса: Norbert Scanella / imago-images.de / Global Look Press"
"gObuOvzoCZQ","ФЕЕРИЧНАЯ КОНЦОВКА! ► Incredibox v7 Jeevan #2","2019-12-21T08:16:19.000Z","UCXHczq_8PytR6mEJeUTTrqw","ViteC ► Play","20","19.22.12","incredibox v7|incredibox все концовки|incredibox.com|incredibox|инкредибокс|инкредибокс 7|инкредибокс скачать|incredibox скачать|incredibox android|jeevan|incredibox ios|диджей|dj|битбокс|симулятор диджея|музыка|смешная игра|креатив|взрыв мозга|вынос мозга|реакция|витек плей|витек|vitec|vitek|vitec play|vitek play","94211","5463","184","493","https://i.ytimg.com/vi/gObuOvzoCZQ/default.jpg","False","False","Игра Incredibox обзор, прохождение и реакция на русском. Инкредибокс - для тех в ком живет диджей.🔴 Плейлист Incredibox: http://bit.ly/I_VP► Список игр на канале: http://bit.ly/vpgames❏✔ Паблик ВК: http://vk.com/vitecp✔❏ Подписка на канал: http://bit.ly/SubVitecP💰 Стать спонсором: https://www.youtube.com/channel/UCXHczq_8PytR6mEJeUTTrqw/join► Игры я покупаю здесь: http://bit.ly/VitecPsteambuy ◄Группа Вконтакте: http://vk.com/vitecpМой стрим: http://goodgame.ru/channel/vitecp/ или http://twitch.tv/vitecpМой Steam: http://steamcommunity.com/id/vitecpСсылка для подарков Steam: http://bit.ly/SteamGift_VitecP ▄▄▬▬▬▄▄▄▄▬▬▬▄▄▄▄▬▬▬▄▄▄▄▬▬▬▄▄✔ ПРЕЖДЕ ЧЕМ ПРЕДЛОЖИТЬ ИГРУ:http://bit.ly/vpgames - Список всех игр на канале✔ Обзоры, первые серии, первые взгляды:http://bit.ly/VitecPWhatis✔ Смеемся вместе:http://bit.ly/MindBlow_VitecP▄▄▬▬▬▄▄▄▄▬▬▬▄▄▄▄▬▬▬▄▄▄▄▬▬▬▄▄#incredibox #инкредибокс #витекплей"
"_8q0kg5pMNQ","Денис Лебедев объявил об уходе из бокса | Мир бокса","2019-12-21T17:58:58.000Z","UC7s3f9X9jX1zgbd9e_PQznQ","МИР БОКСА","17","19.22.12","Мир бокса|бокс|нокаут|спорт|чемпион|Россия|Александр Поветкин|Денис Лебедев|Григорий Дрозд|Дмитрий Кудряшов|Дмитрий Бивол|Сергей Кузьмин|Эдуард Трояновский|Алексей Папин|Алексей Егоров|Георгий Челохсаев|Евгений Смирнов|Исраил Мадримов|Шахарм Гиясов|Муроджон Ахмадалиев|Узбекистан|удар|лучшие моменты|полный бой|прямая трансляция|ko|Moscow|boxing|cruiserweight|matchroomboxing|Technical Knockout|TKO|Win|fight","31578","513","38","110","https://i.ytimg.com/vi/_8q0kg5pMNQ/default.jpg","False","False","#ДенисЛебедев #Лебедев #МирБокса Денис Лебедев объявил об уходе из бокса40-летний экс-чемпион мира в первом тяжелом весе Денис Лебедев объявил о своем уходе из бокса 21 декабря в Красноярске после поражения единогласным решением судей от южноафриканского боксера Табисо Мчуну в поединке за вакантный титул WBC Silver в первом тяжелом весе. 31-летний Мчуну победил со счетом 120-107, 119-108 и 115-112. В третьем раунде Лебедеву было сделано предупреждение за опасное движение головой.Сразу после объявления результата боя Денис Лебедев сообщил, что завершает свою боксерскую карьеру. Всего Денис Лебедев провел на профессиональном ринге 36 боев, одержал 32 победы и потерпел три поражения. Результат одного боя был отменен. Он владел титулами чемпиона мира в первом тяжелом весе по версиям WBA (2012-2018 гг) и IBF (2016 год).Подписывайтесь на официальный канал Мир бокса: https://goo.gl/fl1ukU Официальный сайт: http://www.vsenabox.ru/ Instagram: https://www.instagram.com/worldofboxingpromotions/VKontakte https://vk.com/vsenaboxFacebook: https://www.facebook.com/vsenabox/Twitter: https://twitter.com/worldofbox"
"nIsD6R7F7hc","ЗАБОТА О ТЕБЕ 😍 ПЕРСОНАЛЬНОЕ ВНИМАНИЕ АСМР | BINAURAL PERSONAL CARE 😍 ASMR","2019-12-21T17:00:08.000Z","UC5X7iRFTg24q8X01_W42OGg","HeyHelen ASMR","24","19.22.12","асмр|персональное внимание|забота о тебе|asmr|personal attention|heyhelen","75935","6343","167","964","https://i.ytimg.com/vi/nIsD6R7F7hc/default.jpg","False","False","Приветик, мое солнышко!Сегодня я приготовила очень простое, уютное, расслабляющее видео, в котором я буду заботиться о тебе и помогу уснуть.Это ролик Персональное внимание, в котором я очищу твое лицо, сделаю легкий массаж с расслабляющей эссенцией и уложу тебя спать нежными движениями и визуальными триггерами. Надеюсь тебе понравятся такие расслабляющие, самые приятные процедуры перед сном.Приятного просмотра и прослушивания! ❤️-----------------------------------------------------------------------------------------------------------✔Стримы АСМР : Понедельник, Среда, Пятница - 22:00 МСК (21:00 Киев) ✔ Tingles : https://tingles.app.link/HeyHelen-ASMR✔ Вконтакте : https://vk.com/club163621038✔ Поддержать канал : http://donatepay.ru/don/heyhelenasmr✔ Сотрудничество / Сollaboration - heyhelenasmr@gmail.com✔ Twitch : https://www.twitch.tv/heyhelen_asmr (СОХРАНЕННЫЕ СТРИМЫ) ✔ Instagram : https://www.instagram.com/heyhelen_asmr/✔ Channel support : https://streamlabs.com/heyhelen_asmr"
"pPPsSO7SCbw","Я НЕНАВИЖУ ЗВЕЗДНЫЕ ВОЙНЫ: СКАЙУОКЕР. ВОСХОД","2019-12-21T13:01:42.000Z","UCDM0Ng48_zAMTazoC_XAsaA","Культас","1","19.22.12","Культас|обзор|мнение|фильмы онлайн|ностальгия|звездные войны|звездные войны скайуокер восход|скайуокер восход трейлер|скайуокер восход разбор трейлера|скайуокер восход реакция на трейлер|скайуокер восход новый трейлер|скайуокер восход обзор|скайуокер восход теории|star wars|rise of skywalker|rise of skywalker trailer|rise of skywalker trailer reaction|скайуокер восход сценарий","98131","13819","619","1419","https://i.ytimg.com/vi/pPPsSO7SCbw/default.jpg","False","False","⚡IMBA GAME ENERGY DRINK⚡ - http://bit.ly/IMBA_KultasПромокод - KULTASIMBAМОЙ ЛАЙВ-КАНАЛ: https://www.youtube.com/channel/UCUKozrdkGiiw_MkUSjqssGQПо вопросам рекламы, спонсорства и т.д.: https://goo.gl/WqvpxVЗвездные Войны на большом экране мертвы. Они перестали быть живыми уже давно, и если Последние Джедаи были высокобюджетным избиением инвалида, то Скайуокер Восход - это обоссывание того, что от него осталось. Кейтлин Кеннеди в последний момент вспомнила, что ему еще надо выступать на лекции по теме “как загубить франшизу с мировым именем за миллиарды долларов и сохранить работу” от ее имени, а лучшего способа смыть ему кровь с лица не придумала. Абрамс, конечно, шарлатан, но будь он хоть внебрачным сыном Авалона с Хичкоком - он ВСЕ РАВНО не смог бы спасти этого выродка, спасать уже просто нечего. Лучшее что он мог сделать - это слепить 20 разных фанфиков в один 2-часовой кусок кина, чтобы хоть КАК-ТО объяснить то, что он начал в позапрошлый раз не рассчитывая продолжать, и то что потом из этого насочинял Райан Джонсон, попытаться выехать на пафосе и механических эмоциях от красивых картинок на экране, и больше НИКОГДА к этой франшизе не возвращаться. Я его даже не виню - я бы ТОЖЕ не хотел лепить скульптуру  Микки Мауса на включенной ресторанной плите из мороженого, пока Кейтлин Кеннеди тычет мне зараженной спидом палкой в бок. Хотя за голливудскую зарплату и потерпеть можно, кто сам без греха, как говорится. Все равно же печатная пресса и лидеры мнений, который боятсЯ, что Дисней их на пресс-показы больше пускать не будет, подставят попку, хотя в этот раз даже ОНИ с трудом выжимают из себя улыбку.---------------------------------Патреон - https://www.patreon.com/kulthas (ОТКЛЮЧАЙТЕ VPN И ПРОКСИ, ИНАЧЕ ВАС ЗАБАНИТ БОТ)Донаты - http://www.donationalerts.ru/r/darth_kaelthasили:СберБанк - 4276 3800 1254 6052Yandex - 410011963487717PayPal - darthkaelthas1@gmail.comWMR - R640778412061---------------------------------Вконтакте: http://vk.com/tzarkaelthasТвиттер: https://twitter.com/kulthasИнстаграмм: http://instagram.com/kulthas#ЗвездныеВойны#StarWars#Дисней#StarWarsRiseOfSkywalker#Disney"
"OaUCCMEITMc","55x55 – АМЕРИКАНСКИЙ ПАПАША","2019-12-21T10:07:23.000Z","UCBnKMiYzbE9opd0Mtg9B7Dg","55x55","10","19.22.12","55x55|АМЕРИКАНСКИЙ ПАПАША|American Dad|Apocalypse Soon|55х55","163579","18624","12257","1954","https://i.ytimg.com/vi/OaUCCMEITMc/default.jpg","False","False","Скачивай American Dad! Apocalypse Soon по ссылке бесплатно - https://goo.gle/36tYzAxПодписывайтесь на инстаграм: https://www.instagram.com/the55x55Вступайте в группу: https://vk.com/lvxlvПодписывайтесь на страницу: https://vk.com/55x55Сотрудничество и реклама: 55x55@wildjam.ru"
"uY07g-34xUc","КОМНАТА СТАРИННЫХ КЛЮЧЕЙ!  2 серия! Новинка 2019. Сериал 2019. Русские сериалы","2019-12-21T18:30:08.000Z","UCk8JJTJHMb7DXTrA7Ivw7cQ","ПРИОРитетное Кино","1","19.22.12","КОМНАТА СТАРИННЫХ КЛЮЧЕЙ|КОМНАТА СТАРИННЫХ КЛЮЧЕЙ онлайн|КОМНАТА СТАРИННЫХ КЛЮЧЕЙ сериал|КОМНАТА СТАРИННЫХ КЛЮЧЕЙ сериал 2019|КОМНАТА СТАРИННЫХ КЛЮЧЕЙ 2019|КОМНАТА СТАРИННЫХ КЛЮЧЕЙ сериал ютуб|КОМНАТА СТАРИННЫХ КЛЮЧЕЙ 2 серия сериалы|смотря сериал|смотреть сериалы|сериалы онлайн|смотреть сериалы онлайн|сериалы 2019|русские сериалы|лучшие сериалы|смотреть сериалы 2019|смотреть русские сериалы|новые сериалы","36157","213","23","34","https://i.ytimg.com/vi/uY07g-34xUc/default.jpg","False","False","Все серии сериала: КОМНАТА СТАРИННЫХ КЛЮЧЕЙ https://www.youtube.com/playlist?list=PLwGYOMH3NrzqJW0ah9awCtdEHYl2lA8FChttps://www.youtube.com/channel/UCk8JJTJHMb7DXTrA7Ivw7cQ Подписывайся на ПРИОРитетное Кино!  Минимум рекламы, максимум хороших фильмов!Цикл «Приключения Бабкина и Илюшина» по романам Елены Михалковой.Анжей Ковальский – человек-загадка, о прошлом которого никто ничего не знает. Он живет в роскошном особняке, похожем на сказочный замок. В нем есть особая комната, где собраны старинные ключи. К Анжею обращаются за решением проблем: по слухам, его метод творит чудеса. Правда, метод весьма странный: выслушав клиента, он подбирает для него ключ из своей коллекции. Вот и все. Получив ключ, человек неожиданно решает свою проблему. Чудо? Или особая психологическая методика? Детективы Илюшин и Бабкин приезжают в особняк среди других клиентов, но не для того, чтобы решить свои проблемы. Анжей нанимает сыщиков, чтобы найти бесследно пропавшего эконома. Но вскоре выясняется, что настоящая загадка – не в этом. Чтобы подобрать ключ к Анжею и его проблеме, героям приходится уйти в далекое прошлое… #сериал"
"UBvQxDJBnCA","Мощное алиби закладчицы адской машинки","2019-12-21T22:45:05.000Z","UCVPYbobPRzz0SjinWekjUBw","Анатолий Шарий","23","19.22.12","шарий|анатолий шарий|шарий анатолий|шарий новое|шарий видео|шарий блог|ifhbq","215159","28014","376","5925","https://i.ytimg.com/vi/UBvQxDJBnCA/default.jpg","False","False",""
