video_id,title,publishedAt,channelId,channelTitle,categoryId,trending_date,tags,view_count,likes,dislikes,comment_count,thumbnail_link,comments_disabled,ratings_disabled,description
"NKtzKwMuO60","ПРИГОТОВИЛИ ОГРОМНЫЙ  СНИКЕРС ВЕСОМ 80 КИЛОГРАММ.","2019-12-21T06:30:00.000Z","UCw9L4gmA0nAsg6rlxBncByg","vanzai","22","19.22.12","ПРИГОТОВИЛИ ОГРОМНЫЙ СНИКЕРС ВЕСОМ 80 КИЛОГРАММ.|приготовили огромный сникерс|огромный сникерс дома|большой сникерс|сникерс в домашних условиях|как приготовить сникерс|рецепт сникерса|snickers|ванзай|vanzai|как сделать нугу для сникерса|сникерс с арахисом|лучший рецепт сникерса|рецепты|как готовить|еда|гигантская еда трум трум|огромная еда vanzai","2159765","310652","3470","18255","https://i.ytimg.com/vi/NKtzKwMuO60/default.jpg","False","False","Скачивай War Thunder бесплатно и получай бонусы - https://wtpub.ru/vanzai---------------------------------------------------------------------------------------------------------------------------------sunray.advert@gmail.com _______________________________________________ VK: https://vk.com/id168352990 _______________________________________________ Instagram: https://www.instagram.com/vanzai_live/-----------------------------------------------------------------------------------ВСЕМ ПРИВЕТ .сегодня мы приготовим огромный сникерс весом в 80 килограмм"
"K_k6FUcjY1U","ВЫБЕРИ ПРАВИЛЬНЫЙ ИНГРИДИЕНТ из БЛЮДА ЧЕЛЛЕНДЖ !","2019-12-21T09:00:41.000Z","UC2tsySbe9TNrI-xh2lximHA","A4","24","19.22.12","ВЫБЕРИ ПРАВИЛЬНЫЙ ИНГРИДИЕНТ из БЛЮДА ЧЕЛЛЕНДЖ|ВЫБЕРИ ПРАВИЛЬНЫЙ ИНГРИДИЕНТ|ВЫБЕРИ ПРАВИЛЬНЫЙ|ИНГРИДИЕНТ ИЗ БЛЮДА|ВЫБЕРИ ПРАВИЛЬНОЕ БЛЮДО|ИНГРИДИЕНТ|челлендж|влад а4 еда|пробуем еду челлендж|влад бумага|ВЛАД А4|А4|A4","3883946","323058","15002","33513","https://i.ytimg.com/vi/K_k6FUcjY1U/default.jpg","False","False","Супер крутая игра Homescapes по ссылке:https://goo.gle/BumagaТакже в игре сейчас большое праздничное событие, в гости к Остину приходят гости и он вместе с ними готовит весь дом к Новому Году.Помимо этого с 20 по 23 декабря будут нереальные рождественские скидки, не упустите эту возможность.Все подробности в обновлении к игреСсылка на МЕРЧ ВЛАДА А4 http://bit.ly/A4_merchКанал А5: https://bit.ly/2PGspuGКачай приложение “А4 Колесо фортуны” по ссылке - https://a4roulette.onelink.me/v63S/go В этом ролике мы будем КУШАТЬ !!! Но мы будем есть необычные блюда, а БЛЮДА ПО ЧАСТЯМ !!! НАПРИМЕР: если нам приносят бутерброд, ты один из нас будет есть батон, второй колбасу, а третий СЫР !!! Ролик получился очень интересный, смотри его ДО КОНЦА !!! ● Instagram - https://www.instagram.com/a4omgПОДПИСЫВАЙСЯ ЧТОБЫ УВЕЛИЧИТЬ МОЮ САМООЦЕНКУ !) ▶ РЕКЛАМА, СОТРУДНИЧЕСТВО: a4a4a4a4pr@gmail.com▶ПРОШЛОЕ ВИДЕО - https://youtu.be/2s4QH4VzNl8● Instagram - https://www.instagram.com/a4omg● VKontakte: https://vk.com/id240651878● Паблик VK : https://vk.com/a4_tv● Моя партнерская сеть MediaCube :  http://bit.ly/A4_mcn"
"VHMu49JZdx8","Ford Fusion: перекупские игры","2019-12-21T15:02:43.000Z","UCn1YQ4g_kKwJbt0MUVZfY7A","Жизнь Синдиката","22","19.22.12","Жизнь синдиката|ведра|дешевки|Жекич Дубровский|Гриша Завозин|Операция феррари|Тачка Невозврата|Тачка за копейки|дыра в порогах|автоведра|автохлам|перевернулся|в мясо|тачка за сотку|разбитая машина|перекупские игры|бабушка ездила|торг|перекупы|олимпийские игры|ford|ford fusion","871426","50392","1542","1016","https://i.ytimg.com/vi/VHMu49JZdx8/default.jpg","False","False","Качай Raid: Shadow Legends бесплатно ✅ IOS: https://clik.cc/hH4wR ✅ ANDROID: https://clik.cc/YM5hP и получи 💰 50,000 серебряных монет и Эпического Чемпиона 💥 на 7-ой день программы для новых игроковПо вопросам рекламы, сотрудничества DubrovskiySyndicate@mail.ru Основной канал: https://www.youtube.com/user/fullluxПсихопаты Синдиката: http://www.youtube.com/c/ПсихопатыСиндиката/МУЗЫКА ИЗ ВИДОСА: https://vk.com/motorheartstudioКавер  Blur - Владивосток 2000: https://www.youtube.com/rockprivet"
"zdrMY3ftWag","24 ЧАСА КАК БОМЖ - ВЫЖИВАНИЕ!)","2019-12-21T18:43:24.000Z","UCeHB-V2gQRjjBUg6PUdsnqg","GopherVid","24","19.22.12","выживание|лайфхаки|бомж|для бомжей|как выжить|выживание 24 часа|24 часа|выживание в лесу|как выжить в лесу|огонь|жизнь|как сделать|24 часа челлендж|доставка|в поисках еды|без денег","834952","69507","3429","3663","https://i.ytimg.com/vi/zdrMY3ftWag/default.jpg","False","False","Беспроводные наушники CaseGuru CGPods 5.0 http://bit.ly/2DQkPZ7 качественный звук, 17 часов автономной работы и защита от воды. В ТРИ раза дешевле «яблочных ушей»!Привет!) Сегодня у нас выживание 24 часа. В этом видео с помощью знаний, лайфхаков, может самоделок мы попытаемся выжить 24 часа как бомж. Я уже снимал лайфхаки для бомжей - это продолжение) Скиллы выживания могут притворится всем)• Моя страница ВК: https://vk.com/gophervidman• Реклама и сотрудничество: gopher@wildjam.ru♥ Моя (самая крутая) партнерка YouTube: www.air.io/r/gophervid"
"ciEzeXDvNDA","Платошкин о пресс-конференции Путина","2019-12-21T14:44:53.000Z","UCDqwBnBsFWxFj0ABSbE2Kvw","Николай Платошкин","29","19.22.12","Платошкин|Ленин|СССР|Советский|Союз|Россия|Политика|Социализм|Коммунисты|Путин|пресс-конференция","264724","27297","1256","6967","https://i.ytimg.com/vi/ciEzeXDvNDA/default.jpg","False","False","#Платошкин, #Путин, #пресс-конференция, #Ленин, #Социализм, #Россия, #СССРНИКОЛАЙ НИКОЛАЕВИЧ ПЛАТОШКИНЛидер Движения за новый социализм, российский политик, общественный деятель, политолог и историк. Доктор исторических наук, заведующий кафедрой международных отношений и дипломатии Московского гуманитарного университета. Автор 18-ти книг, политический эксперт на телевидении.Наше дело правое, враг будет разбит, победа будет за нами!Поддержать Движение За Новый Социализм вы можете по ссылкам: https://www.donationalerts.com/r/platoshkinhttps://static.donationalerts.ru/uploads/qr/3100569/qr_a8727d71f914e7164547f3622ce2438d.pngИли перевести деньги на карту ВТБ: 4272290017264334Наша почта:centr.shtab.platoshkina@socialism.ruНаш сайт:https://socialism.ruНаши соцсети:https://www.youtube.com/channel/UCDqwBnBsFWxFj0ABSbE2Kvwhttps://vk.com/platoshkin.nikolayhttps://www.facebook.com/platoshkin.nikolayhttps://www.instagram.com/platoshkin_nikolaihttps://t.me/Platoshkin_nikolaihttps://ok.ru/nikolay.n.platoshkinСсылки на региональные группы поддержки:https://www.facebook.com/groups/359554654809199https://vk.com/gp_nnplatoshkinahttps://ok.ru/group/54959072805052"
"eLT5vJDBjkU","15 проблем девушек, о которых парни не подозревают","2019-12-21T08:00:13.000Z","UCA8x119TMd1esbI3woeIbQg","Трум Трум СЕЛЕКТ","26","19.22.12","девушки|проблемы|нелепо|глупо|женские|женские проблемы|проблемы девушек|как знакомо|это про меня|ну почему я|упс|лажа|парням не понять|если не везет|когда не везет|девушки поймут|Трум трум Селект|девушки поймут а парни нет|жиза|жизненно","670616","13190","3100","811","https://i.ytimg.com/vi/eLT5vJDBjkU/default.jpg","False","False","Подписывайся на канал: https://www.youtube.com/channel/UCA8x119TMd1esbI3woeIbQg?sub_confirmation=114 психологических трюков для манипуляции людьми: https://youtu.be/X9BmrGWFrAg?list=PLJTrPxyqh-tLeI8xXChakkR-AvDcPjWGcЧтобы красиво выглядеть девушкам ежедневно приходится сталкиваться с трудностями, о которых парни даже не подозревают. Впрочем, для их же спокойствия, парням лучше и не знать о женских проблемах. Но о некоторых из них мы вам расскажем.Музыка:Tobu & Hellberg - Sprinkleshttp://youtube.com/tobuofficialБольше интересного на Трум Трум Селект: Самые популярные видео:19 лайфхаков, которые облегчают жизнь: https://youtu.be/vlC7tL_C8zw14 смешных пранков для друзей: https://youtu.be/qzKNLDDZKYQСъедобная канцелярия! 16 смешных пранков над друзьями: https://youtu.be/pQ8iU1WOSuY19 трюков, чтобы удивить друзей: https://youtu.be/NNcOdRvt7j014 лайфхаков с термоклеем для хендмейда: https://youtu.be/_iPYwDbedLYСамые популярные плейлисты:Лучшие фокусы и трюки: https://www.youtube.com/playlist?list=PLJTrPxyqh-tIIVI8j0yeGyppGjmnFfdPMЛучшие пранки: https://www.youtube.com/playlist?list=PLJTrPxyqh-tIqj_mFORuJzsapX49_s0iLНазад в школу: https://www.youtube.com/playlist?list=PLJTrPxyqh-tKl064Ifn-Qm5ygLXVDPNdDЛучшие лайфхаки: https://www.youtube.com/playlist?list=PLJTrPxyqh-tLeI8xXChakkR-AvDcPjWGcСамодельная косметика: https://www.youtube.com/playlist?list=PLJTrPxyqh-tJqOr1_3k_545My7M4u0I_6★ Давай дружить: Подписывайся на канал: https://www.youtube.com/channel/UCA8x119TMd1esbI3woeIbQg?sub_confirmation=1Facebook | https://www.facebook.com/troomtroom.rus Вконтакте | http://vk.com/troomtroom Pinterest | https://www.pinterest.com/troomtroomru Instagram | https://www.instagram.com/troomtroomru/Troom Troom English: Подписывайся: https://www.youtube.com/channel/UCWwqHwqLSrdWMgp5DZG5Dzg?sub_confirmation=1Troom Troom Español: Подписывайся:  https://www.youtube.com/channel/UCu6oyJJ6PlkeNNv6n26ZNyA?sub_confirmation=1Troom Troom Française:Подписывайся: https://www.youtube.com/channel/UCyNeKmBHI10u4bwYEKimlZA?sub_confirmation=1Troom Troom Deutsch:Подписывайся: https://www.youtube.com/channel/UCzgmxZIlgfH1fgch7OpigIA?sub_confirmation=1Troom Troom Japanese:Подписывайся:   https://www.youtube.com/channel/UCPCwT9JMWPjg6xAWrQxhQaw?sub_confirmation=1Troom Troom Chinese:Подписывайся: https://www.youtube.com/channel/UCV3NWBs2K7pOEGmI4w_2dhg?sub_confirmation=1Troom Troom Português:Подписывайся: https://www.youtube.com/channel/UCgCQlMYN2XypwYC2wcR32bA?sub_confirmation=1О канале Трум Трум Селект: Простые мастер-классы - как сделать своими руками классные поделки! У нас на канале вы найдете мастер-классы по скрапбукингу, плетению из газетных трубочек, поделки из папье-маше и многое другое. Сделайте это легко! Make it easy!По вопросам сотрудничества пишите на:  troomtroom.ru@gmail.comВопрос дня: понравилось наше новое видео? Пиши в комментариях!Не забудь подписаться, нажать на колокольчик рядом с подпиской, ставить лайки и делиться видео с друзьями!"
"QJ3plCVFO50","Аниматор недоглядел за ребенком // Черный список","2019-12-21T07:00:04.000Z","UCsk9ntn2afzIqInnx2jB8gw","Телеканал ПЯТНИЦА","24","19.22.12","аниматор|детский аниматор|худший аниматор|аниматор на детский праздник","482068","15339","3255","1787","https://i.ytimg.com/vi/QJ3plCVFO50/default.jpg","False","False","Земсков проверяет детских аниматоров. Что нужно делать, если ребенок поранился, какие документы нужно проверять при заказе candy bar. Подписывайтесь на телеканал Пятница!:Сайт: https://www.friday.ruВКонтакте: https://vk.com/friday_ruFacebook: https://www.facebook.com/friday.ruTwitter: https://twitter.com/friday_tvInstagram: https://www.instagram.com/fridaytvYouTube: https://www.youtube.com/user/FridayTVChanel#аниматор #черный список #пятница"
"G8MytuRpCgY","Моя подруга наркоманка","2019-12-21T10:41:37.000Z","UC3G8TFjln8AalKZWzxGnYiQ","Будни подростка","1","19.22.12","Это жизнь|время историй|мультфильм|правдивая история|истории в мультфильмах|правдивые истории|нарисуйте мою историю|анимация|история|реальные истории|анимационный канал|Жизненные истории|школьные истории|школа|школьная история|история из школы|история анимации|история из жизни","288885","9931","735","1397","https://i.ytimg.com/vi/G8MytuRpCgY/default.jpg","False","False","Всем привет. Сегодня Маша хочет, чтобы вы услышали ее историю и дали ей ответ – правильно она поступаю или нет. Я не сопротивлялась и постепенно втянулась в общение с людьми. Вероника официально стала моей лучшей подругой, причем не только по ее собственной версии. Мы стали довольно активно тусить, и лет до 14 практически не расставались. Потом появились другие заботы и все время уделять играм у нас не получалось, но дружба не закончилась – просто стала чуть обдуманнее и взрослее. Вероника познакомила меня с моим первым парнем. Вероника отвела меня на танцы, где я задержалась надолго, точнее до сих пор задерживаюсь, только теперь в качестве преподавателя и иногда – работы с труппой. Когда мы перешли в старшую школу, Ника познакомилась с каким-то непонятным парнем и стала с ним встречаться. Я один раз его видела, и он показался мне максимально странным, о чем я ей сразу сказала. А она обиделась, заявила, что очень его любит, а я просто завидую их счастью. Какое-то время мы не общались, где-то около года - она сама не отвечала на звонки и отказывалась видеться. А потом я случайно столкнулась с ней в продуктовом. Выглядела Ника паршиво. Из хорошенькой, 16летней девушки, остались одни глаза, а все остальное выглядело так, как будто ее в стиральной машинке прокрутили и выкинули – серая, осунувшаяся, с какими-то непонятными морщинами и обвисшей кожей на лице. Я, если честно, офигела и просто не смогла выйти из ступора – так и стояла, глядя на нее. А Ника быстро выскочила из магазина, даже продукты забыла. Хотя там тех продуктов… В ее тележке лежал хлеб и 2 банки пива. Я домой пришла и тут же кинулась звонить ее маме. А та начала рыдать в трубку и сообщила, что уже полгода Ника с ней не живет, и где обитает – она сама не в курсе. Все началось с того парня подозрительного. Как я и подумала, он оказался наркоманом, и поначалу Ника думала, что силой любви его спасет. А потом он втянул ее в весь этот кошмар – она стала воровать у мамы деньги, употреблять наркотики и периодически устраивать загулы в неизвестном направлении. Не буду описывать, как мы Нику искали по всем притонам. Я присоединилась к ее маме и позвала наших общих друзей. Вместе мы ее таки нашли, но как по мне – лучше бы она исчезла навсегда. Поначалу мы пытались ее реабилитировать, даже собирали деньги на ее лечение, но потом… Ника отказывалась лечиться, при малейшем недосмотре сбегала, один раз я заснула, а она сняла с меня кулон золотой, который мне от покойного папы достался, и убежала через балкон. На этом мое терпение кончилось. Я перестала с ней общаться, извинилась перед ее мамой и начала жить своей жизнью. И тут внезапно активизировалась моя мама. Она стала выговаривать мне, что я – отвратительная подруга, ужасный человек и вообще неблагодарная сволочь, потому что бросила подругу в беде. На мои фразы о том, что я пыталась, а наркотики – ее собственный выбор, меня, конечно, никто не слушал.По версии мамы я должна была сама лечь рядом и помереть, но подругу вытащить. Хуже, она стала всем знакомым рассказывать, как я бросила человека в беде, и что она не уверена, что я так же не поступлю с ней, когда она состарится. О наркотиках и том, что я несколько месяцев пыталась что-то сделать, не было сказано ни слова. Эпик случился, когда мама выставила меня из дома со словами о том, что я должна пойди и помочь Нике, иначе она перепишет квартиру на государство, а сама, как на пенсию выйдет, уедет в дом престарелых. Я осталась на улице. Слаба Богу, меня приютила моя еще одна подруга, а потом моя бывшая учительница танцев помогла мне с общежитием как сотруднику детского центра. Я, если честно, вообще не понимаю вот этого «умри, но помоги». А еще мне элементарно страшно за свою жизнь и здоровье. Я видела тех, с кем Ника плотно общалась. Это уже не люди, это монстры, которые за деньги и новую дозу убьют, покалечат, обворуют за здорово живешь. У них уже нет ни морали, ни принципов, только желание получить свой кайф. И я считаю, что в Нике моей подруги больше нет, потому что моя Ника никогда не стала бы так себя вести."
"rJdS_qKuAoU","КРУТЫЕ СПОСОБЫ НЕЗАМЕТНО ПЕРЕКУСИТЬ НА УРОКЕ || Школьные лайфхаки и розыгрыши от 123 GO!","2019-12-21T10:11:47.000Z","UCMZKCZ23VTy_D743H56iuJw","123 GO! Russian","24","19.22.12","123Go!|123GO|123GO!|сделай сам|розыгрыш|розыгрыши|смешные розыгрыши|шутка|одежда|как это сделать|видеоурок|друзья|друг|подруга|скучно|парить в воздухе|розыгрыши для пар|как разыграть|разыграть друзей|смешно|лучшие розыгрыши|простые розыгрыши|видео с розыгрышами|DIY|самоделка|пранк|пранки|челлендж|челленджи|веселье|весело|123 go|123go|дружелюбно|как","689988","9087","1745","591","https://i.ytimg.com/vi/rJdS_qKuAoU/default.jpg","False","False","ПОДПИСЫВАЙТЕСЬ: http://bit.ly/2VPeXYtНеважно, чем вы заняты, голод может возникнуть, когда угодно. А благодаря этим умным лайфхакам, вы сможете перекусить в любой момент, даже если сидите на уроке.Чтобы не урчал животик, возьмите на заметку эти крутые школьные лайфхаки! Поделитесь ими с одноклассниками!Не забудьте подписаться на наш канал, чтобы увидеть еще больше потрясающих видео. Приятных перекусов, друзья!#смешно #школьныелайфхаки #DIYМузыка — Epidemic Sound: https://www.epidemicsound.com/Материалы со стоков: https://www.depositphotos.com https://www.shutterstock.com"
"Hy760WqFvYE","Моя девушка и парень БЛИЗНЕЦЫ !","2019-12-21T14:00:14.000Z","UC3GwlqPMcrGtN_xeOqwRaeQ","ЭРИКА ХАНТЕР","1","19.22.12","Это жизнь|моя история|время историй|правдивая история|правдивые истории|нарисуйте мою историю|анимация|история|реальные истории|анимационный канал|эрика хантер|твоя история|моя анимированная история|моя анимированная жизнь|близнецы|близняшки|парень и девушка|отношения|любовь|первая любовь","226095","13392","595","993","https://i.ytimg.com/vi/Hy760WqFvYE/default.jpg","False","False","Спасибо за просмотр !"
