video_id,title,publishedAt,channelId,channelTitle,categoryId,trending_date,tags,view_count,likes,dislikes,comment_count,thumbnail_link,comments_disabled,ratings_disabled,description
"zoa1UdTWDN4","ПОЧЕМУ поменяли орла на российских деньгах?","2019-12-21T15:00:52.000Z","UCkUK1bWH4jlHrUTke9aX5Tg","Михаил Советский","22","19.22.12","ПОЧЕМУ поменяли орла на российских деньгах|деньги|центральный банк|символика цб|цб|поражение СССР|развал СССР|пакт капитуляции СССР|холодная война|купюры|монеты|герб российской федерации|двуглавый орёл|российские деньги|цб рф|курс цб|ставка цб|банк|рубль|доллар|Путин|политика|фрс сша|кому принадлежит центральный банк|звр|золотовалютный резерв россии|глазьев|национализация цб|эмиссия рубля|мвф|международный валютный фонд|ссср|михаил советский","40557","5012","164","1099","https://i.ytimg.com/vi/zoa1UdTWDN4/default.jpg","False","False","На российских рублях никогда не было ГЕРБА России. И вот недавно он появился. В чем причина? И что еще скрывают наши денежные власти?----------------------------------------------------------------------------------------------------------------------------------------Группа в ВК - https://vk.com/clubsovetskij Группа в ОК - https://ok.ru/sovetskijПодпишитесь на канал -  https://www.youtube.com/channel/UCkUK1bWH4jlHrUTke9aX5Tg?sub_confirmation=1﻿---------------------------------------------------------------------------------------------------------------------------------------------Поддержать создание роликов  4276450017181948  КАРТА СБЕРБАНК410012584333034  ЯНДЕКС ДЕНЬГИR464327711283 ВЕБМАНИ----------------------------------------------------------------------------------------------------------------------------------------------Если бы  акт о капитуляции был в открытом доступе, то о нем бы знали все. Это бы входило в школьную программу. А пока проигрыш СССР в холодной войне выглядит как простая сдача своих позиций Руководством СССР. Но после поражение в холодной войне Советский Союз получил все сопутствующие атрибуты пораженной страны: оккупацию (сейчас войска НАТО находятся на территории бывшего СССР), выплата контрибуции (стоит только вспомнить урановую сделку), сейчас все активы СССР находятся в западной юрисдикции, т.е. в офшорных зонах, ну, и наконец, внешние управление (Россия сейчас управляется извне, среди прочего, через Конституцию, написанную под диктовку западных советников).Анализируя происходящие, вывод один: Россия - это осколок страны, которая потерпела поражение в войне. Естественно, победитель  взял под контроль и печатный станок денег пораженной  страны. Наш Центральный банк работает в интересах США и Европы. Зная эти факты, вроде, все встает на свои места, почему на наших деньгах нет герба, нет слова государственный и т.п. Теперь конкретика. Начнем с герба. По заявлению самого Центрального банка, это не герб временного правительства. Это рисунок русского художника Ивана Билибина. Иван Билибин был книжным иллюстратором. Наверное, самые известные произведения Билибина, это иллюстрации для русских сказок. Так вот, герб временного правительства 1917 года и двуглавый орел Центрального банка, это, якобы, разные произведение одного автора - Билибина, по заявлению Центрального банка.  И в чем именно отличие, Центральный банк не уточняет. Почему вообще на деньгах размещается герб временного правительства, а не герб Российской Федерации?  Во-первых, как сказал Путин, что рисовать на деньгах России решает  Центральный банк. Наш Центральный банк, по Конституции России, независимая структура и ни правительству, ни Президенту не подчиняется в своей деятельности. Во-вторых, Центральный  банк выбирал свою символику в 1992 году, когда еще не был утвержден современный герб. И, чисто теоретически, они могли бы даже герб Соединенных Штатов Америки выбрать. Так, кстати, честнее было бы. Ну, а почему же с 2016 года на монетах появился герб России? Официально причину никто  не заявляет. Вообще, если ссылаться на законодательство России, Центральный банк мог изображать на своих деньгах герб России с 2000. Так что то, что Центральный банк не мог этого сделать, якобы, из-за акта о капитуляции, это не правда. По словам некоторых патриотов якобы герб россии  на деньгах появился из-за того, что в центральном банке работают национально настроенные люди. Но лично я в этом никакую пользу не вижу. это никак не влияет на денежно кредитную политику. Это вообще не на что не влияет а наоборот только усыпляет граждан. Вот если бы это патриоты в цб написатали на деньгах герб сша то пользы было бы ы миллион раз больше. Люди бы хоть проснулись а так наоборот цб просто мимикрирует под государство а на самом деле это отдельный организм паразит. Вообщем по неизвестной причине совет директоров центрального банка решил изображать на монетах и купюрах 200 и 2000 герб россии. Я предположу, что это для усыпления граждан мол все нормально банк Российский, не переживайте.    А в чем же вообще проблема для граждан России.  Проблема в том, что наш центральный банк из-за отсутствия национальных институтов которые запрещены 13 статьей конституции  и которые бы разрабатывали государственную стратегию страной  управляется международными спец. учреждениями типа мвф. И рекомендации мвф обязательны в соответствии с 15 статьей конституции. И так как нашим банком управляет геополитический противник естественно он это делает в свою пользу. Привязав эмиссию рубля к своей валюте. Такая работа центрального банка называется каренси борд.#Советский"
"8Sn6WqqGHvI","МАЛЕНЬКОЕ против БОЛЬШОГО челлендж!","2019-12-21T11:05:00.000Z","UCL4JRO-eW2JtTxo-XVzxtQg","Masha Zoom","24","19.22.12","маленькое против большого|миниатюрное против гигантского|большое против маленького|крохотное против гигантского|гигантская еда|челлендж с едой|обычная еда против|24 часа едим|челлендж|маша зум|мини еда","90455","8032","138","708","https://i.ytimg.com/vi/8Sn6WqqGHvI/default.jpg","False","False","ПОДПИСАТЬСЯ НА КАНАЛ ▶  https://www.youtube.com/channel/UCL4J...ИНСТАГРАМ МАШИ - https://www.instagram.com/mzzoom/ ИНСТАГРАМ ДЕНИСА - https://www.instagram.com/denis_zzoom/По поводу рекламы и предложений писать только сюда: mzzoomwork@mail.ruПривет! Ты на канале Маша Зум ! а это Новый челлендж - эксперимент ! Вторая часть челленджа - миниатюрное против гигантского! Нам предстоит решить что же лучше большая еда или маленькая! надеюсь вам нравятся наши челленджи с едой)МОЕ ПРЕДЫДУЩЕЕ ВИДЕО - https://youtu.be/RL-w1CS4Yto#гигантскаяеда #миниеда #челлендж #challenge #машазум"
"UBSNCnLw190","#МОНТЯН: Эй, гастарбайтеры! Вместо Москвы идем на Берлин!","2019-12-21T18:00:39.000Z","UCFt4th33h9eWcatzwMcsQxg","Тетяна Монтян","23","19.22.12","Україна|Украина|Россия|Гастарбайтеры|Рынок труда|Германия|Соросята|Сорос|Зеленски","107092","7105","222","1215","https://i.ytimg.com/vi/UBSNCnLw190/default.jpg","False","False","🏅 ПОДДЕРЖИТЕ КАНАЛРанний доступ к новым видео и прочие плюшки:• На «Патреоне» → https://www.patreon.com/join/montyan• На «Бусти» → https://boosty.to/montyan★ ★ ★ОБ ЭТОМ ВИДЕОЗацените-ка, какой маразм недели отмочили наши соросята-поросята в рамках «борьбы с агрессивным агрессором», за которой, как обычно, скрывается только тупость и жажда наживы на нелюбимой стране. И вы еще спрашиваете, почему я смеюсь? Да иначе впору плакать!★ ★ ★АУ, РЕКЛАМОДАТЕЛИ!Вместо стремной YouTube-рекламы с удовольствием вставлю в свои видео ваши рекламные ролики. И зрителям облегчение — и вам известность. 🤩 Присылайте свои предложения на montyan2012@gmail.com, обсудим. 😊★ ★ ★ХОТИТЕ ЖИТЬ В СОГЛАСИИ С СОСЕДЯМИ?Закажите книгу Элинор Остром «Управление общим» в моем профессиональном переводе на украинский и русский (с моим же автографом) по ссылке: https://bit.ly/ostrom_montian.Просвещайтесь, набирайтесь ценнейших знаний о том, как жить со своими соседями в мире и гармонии — если это возможно в принципе."
"BtbsJMV2Cs0","ЖЕНЯ ЭВАНС. ИНТЕРНЕТ МАГАЗИН. ПЕРЕЕЗД В АМЕРИКУ. СКАЗКИ ОТ ВИТАЛИЯ КОВАЛЁВА. РАЗБИРАЕМ ДЕТАЛИ","2019-12-21T07:45:06.000Z","UCF1aTvgB53z-vkuu5LD-dKw","Anton S","22","19.22.12","женя эванс|виталий ковалёв|женя эванс переписка|как блоггеры живут в америке|вся правда про америку|почему я не уехал в америку|как зарабатывают русские блоггеры в америке|владос мирос|влад мирос женя эванс|evgeny evans|интернет магазин жени эванса","72797","3507","1279","1224","https://i.ytimg.com/vi/BtbsJMV2Cs0/default.jpg","False","False","ПОДДЕРЖИ СПЛЕТНИКОВ И СТАНЬ СПОНСОРОМ!https://www.youtube.com/channel/UCpQWh9JggVV9ZKz7IWrHAEA/joinженя эванс, виталий ковалёв, женя эванс переписка, как блоггеры живут в америке, вся правда про америку, почему я не уехал в америку, как зарабатывают русские блоггеры в америке, владос мирос, влад мирос женя эванс, evgeny evans, интернет магазин жени эванса, Сотрудничество/collaboration: norgesboy@gmail.com Оформить подписку на канал и стать спонсором!https://www.youtube.com/channel/UCF1aTvgB53z-vkuu5LD-dKw/join-------------------------------------ПОДПИСЫВАЙТЕСЬ!МОЙ ВЛОГОВЫЙ КАНАЛ https://www.youtube.com/channel/UCpQWh9JggVV9ZKz7IWrHAEAПОЛУЧИ СКИДКУ €25 НА ПЕРВУЮ КВАРТИРУ AirBNB  https://www.airbnb.com/c/antons5139ПОЛУЧИ СКИДКУ 20% НА ПОКУПКУ В ЛАЙМ КРАЙМ Lime Crime  https://www.talkable.com/x/39yX1AПолучи $5 скидки на секретную коробку KAWAIIBOX! https://www.kawaiibox.com?raf=ref2496925Предыдущее видео https://youtu.be/6cj-wu3y1w0МОЙ ИНСТАГРАМ https://www.instagram.com/suvorkin/-------------------------------------НЕ ЗАБЫВАЙТЕ ДЕЛИТСЯ МОИМ ВИДЕО! #antons  #антонс #эванс"
"aoWBpZS9f6k","Почему iPhone из LEGO лучше настоящего. И другая техника тоже?","2019-12-21T16:12:23.000Z","UCt7sv-NKh44rHAEb-qCCxvA","Wylsacom","28","19.22.12","wylsa|wylsacom|iPhone|айфон|Pro|max|про|ноутбук|HP|iPad|Apple Watch","145041","15707","1704","7928","https://i.ytimg.com/vi/aoWBpZS9f6k/default.jpg","False","False","HP Pavilion Gaming 15-dk0069ur (2019) http://bit.ly/391lNjCС использованием разных кубиков LEGO были собраны совершенно разные категории товаров на Яндекс.Маркете: бытовая техника и электроника, обувь и коляски, шины и зубные щётки и многое другое - https://market.yandex.ru/brands--lego/3732937Внимание! Как выиграть Legi Star Wars X-Wing?1. Подписаться на канал Wylsacom2. Оставить комментарий не копируя других участников (полностью или частично)3. Поставить лайк этому видео на YouTubeИтоги подводим в до НГ на канале WylsaStream. Всем удачи!Twitter - http://twitter.com/wylsacomInstagram - http://instagram.com/wylsacomТелеграм Pro - https://tele.click/WylsaredWylsacom Premium - https://www.instagram.com/wylsacom_red/Сайт - http://wylsa.comГруппа вконтакте - http://vk.com/wylsacomFacebook - http://fb.com/wylcomРолик содержит рекламную интеграцию."
"SZn2mV6xBB0","Даша Кошкина - ИНСТА БОМБА [Премьера клипа]","2019-12-21T05:30:00.000Z","UCE9tw5FfhZPH1O4uAXDqcqw","Dasha Koshkina","10","19.22.12","даша кошкина|dasha koshkina|клип|клип даша кошкина|клип 2020|клип 2019|миллион|миллион даша кошкина","136077","10747","1129","0","https://i.ytimg.com/vi/SZn2mV6xBB0/default.jpg","True","False","Даша Кошкина - ИНСТА БОМБА [official video]►Instagram 👉 https://www.instagram.com/dasha.koshkina_/►Facebook 👉 https://www.facebook.com/IDashaKoshkina/#дашакошкина #dashakoshkina #clip2020 #clip2019 #bestsong #musicvideo #song #videoclipБольшое спасибо всей команде, кто принимал участие в съемках видеоклипа:Музыка и видео производство LEO.K ProductionТекст песни:      ИНСТА-БОМБАСонными глазами у экрана телефона Мы с тобой давно знакомы и я знаю мальчик бомба Все страницы мной просмотрены пролайканые фото Ты мне пишешь в инстаграме чтобы провести субботу Только вдвоём и в салоне мы поём Селфи пилим за рулём и о чем то мне шепчешь на ухо  За тонированными стёклами с тобою нас не видно ты сжимаешь мою руку убирая нежно кисти  закружимся в этом танце И ночью этой одержимыНе чувствую с тобой я боли Ведь ты знаешь все пороли Этот парень инста бомба бомба бомба еее Лови мое техно комбо комбо комба еееНас связали этой ночью ночью ночью еееСделай музыку по громче громче громче еееЯ снова к тебе тону в тебе как в океане Встречаем рассвет целую докасаясь губами В салоне музыка на всю орет на всю орет Тебя и только одного хочу одного хочу Куда нас снова с тобой так несёт так несетСдаюсь тебе и в твою пользу счёт пользу счетзакружимся в этом танце И ночью этой одержимыНе чувствую с тобой я боли Ведь ты знаешь все пороли Этот парень инста бомба бомба бомба еее Лови мое техно комбо комбо комба еееНас связали этой ночью ночью ночью еееСделай музыку по громче громче громче еее© 2020 Dasha Koshkina™"
"gLZ3pylHf0U","Подписчик слил 3.600.000 свободки на Новогодние контейнеры в Wot Blitz","2019-12-21T14:54:17.000Z","UCiOVE0pKzWabAZ_qJUXYiVg","D_W_S Channel","20","19.22.12","Wot Blitz|D_W_S|двс|вот блиц|world of tanks blitz|вот блитц|DWS|новости блиц|wot blitz на пк|обновление|новогодние контейнеры|контейнеры блиц|новогоднее приключение блиц|новый год блиц 2020|сундуки за свободку|свободка блиц","35131","2764","587","1412","https://i.ytimg.com/vi/gLZ3pylHf0U/default.jpg","False","False","Оперативно новости по игре здесь: 🎉 Instagram - https://www.instagram.com/d_w_schannel/ 🚧 Группа ВК : https://vk.com/d_w_schannel✨ Альянс [HUMOR], [HUMQR], [HYMOR] - проводит набор игроков! Подробности в шапке кланов альянса, но ВСЕ ответы на ваши вопросы есть в уставе клана: 🎂 https://docs.google.com/document/d/126OzmGJsSawXI0teeP2t6AjAc96VtoeJn0lrjFNkoII/edit?usp=sharing - устав альянса [HUMOR], [HUMQR], [HYMOR].✅ https://vk.com/d_w_schannel?w=wall-118477652_158389 - это подробный пост на Истинную стоимость ГОЛДЫ.✅ https://vk.com/d_w_schannel?w=wall-118477652_123945 - это подробный пост про стоимость ПРЕМИУМ аккаунта.🐱‍🚀 https://youtu.be/YyyStQ4XPx4 - 3 дня према можно получить в Steam💥 https://youtu.be/7rjIfVmUgnA - Свежий обзор T23E3 - Брать или не стоит?💥 https://youtu.be/eToBn5YKizo - Что такое ОТКРЫТЫЙ ТЕСТ и как записаться!😎 https://youtu.be/2BbWUW1DNN8 - Как побеждать в турнирах? | Общие правила | D_W_S | Wot Blitz🚧 https://youtu.be/1mB-gR_ZaYk - как восстановить танк Wot Blitz📢  В этом видео обсуждаем новогодний ивент 2020 Новогоднее приключение и смотрим как подписчик тратит три с половиной миллиона свободки на открытие Новогодних контейнеров в патче 6.6 в Wot Blitz 2020! Здесь бывает полезная информация! Или может быть реклама вашего Клана или даже Канала!) #ОбсуждаемБлицProduction Music courtesy of Epidemic Sound!Трек из ролика: Lies (Killrude Remix) (Instrumental Version) - Chris Coral, Falling Skies - Killrude===============================================================================🎉 Instagram - https://www.instagram.com/d_w_schannel/👉 Моя группа ВК : https://vk.com/d_w_schannel📢 Связаться со мной - https://vk.com/vigabrandoff⭐ Заказать рекламу (например: добрать людей в свой клан) - https://vk.com/vigabrandoff📄 Цены на рекламу - https://vk.com/topic-118477652_39282958😃 Поддержать канал - http://www.donationalerts.ru/r/d_w_s"
